{
  "$schema": "https://json-schema.org/draft/2020-12/schema",
  "$id": "https://raw.githubusercontent.com/DutchJaFO/Quotinator/main/schemas/seed-sources.schema.json",
  "title": "Quotinator Seed Sources",
  "description": "Configuration file for scripts/seed.csx. Lists external quote sources to download and normalise into data/sources/. Each entry specifies a source URL, the parse format, field mappings, and attribution metadata.",
  "type": "array",
  "minItems": 1,
  "items": {
    "type": "object",
    "required": ["name", "url", "format", "license", "attribution"],
    "additionalProperties": false,
    "properties": {
      "name": {
        "type": "string",
        "minLength": 1,
        "description": "Source identifier in 'author/repo-name' form. Used to derive the output filename in data/sources/ (slashes replaced with underscores)."
      },
      "url": {
        "type": "string",
        "format": "uri",
        "description": "URL to download the raw source JSON file from."
      },
      "format": {
        "type": "string",
        "enum": ["quoted-string", "object-array"],
        "description": "Parse strategy: 'quoted-string' for vilaboim-style string arrays, 'object-array' for NikhilNamal17-style object arrays."
      },
      "defaultType": {
        "type": "string",
        "enum": ["movie", "tv", "anime", "book", "person"],
        "description": "Fallback quote type when the source entry does not provide one."
      },
      "fieldMap": {
        "type": "object",
        "description": "Maps Quotinator field names to the keys used in the source JSON. Required when format is 'object-array'.",
        "properties": {
          "quote":  { "type": "string" },
          "source": { "type": "string" },
          "type":   { "type": "string" },
          "year":   { "type": "string" }
        },
        "additionalProperties": { "type": "string" }
      },
      "license": {
        "type": "string",
        "minLength": 1,
        "description": "SPDX license identifier (e.g. 'MIT')."
      },
      "attribution": {
        "type": "string",
        "format": "uri",
        "description": "URL to the source repository or attribution page."
      }
    },
    "if": {
      "properties": { "format": { "const": "object-array" } },
      "required": ["format"]
    },
    "then": { "required": ["fieldMap"] }
  }
}
